{
  "id": "exact-submit-001",
  "profile": "temporal",
  "description": "exact date on a submit → VTODO DUE.",
  "input": {
    "kind": "submit",
    "temporal": {
      "type": "exact",
      "date": "2026-10-05",
      "raw_text": "10月5日まで",
      "deadline_qualifier": "until"
    }
  },
  "expected": {
    "artifact": "VTODO",
    "executable_date": "20261005"
  }
}
